{
  "run_id": "manual-cr-p2-claude",
  "label": "Minimal P2 Context Routing x Claude-Claude",
  "objective": "Tune exactly one research prompt file with Claude as worker and Claude as both runner and judge.",
  "target_surface": "research prompt",
  "worker_backend": "claude",
  "expected_backend": "claude",
  "expected_judge_backend": "claude",
  "retry_policy": {
    "max_attempts": 3,
    "backoff_seconds": 3,
    "retry_on": [
      "timeout",
      "nonzero_returncode",
      "empty_output_parse_error",
      "transient_disconnect"
    ]
  },
  "target_task": "context-routing-skill",
  "target_prompt_path": "autoresearch/src/tasks/context-routing-skill-prompt.md",
  "mutable_paths": [
    "autoresearch/src/tasks/context-routing-skill-prompt.md"
  ],
  "frozen_paths": [
    "docs",
    "product",
    ".agents"
  ],
  "train_suites": [
    "train.yaml"
  ],
  "validation_suites": [
    "validation.yaml"
  ],
  "acceptance_suites": [
    "acceptance.yaml"
  ],
  "primary_metrics": [
    "avg_total_score"
  ],
  "guard_metrics": [
    "parse_error_rate",
    "timeout_rate"
  ],
  "qualitative_veto_checks": [],
  "max_rounds": 1,
  "max_candidate_attempts_per_round": 1,
  "timeout_policy": {
    "seconds": 900
  },
  "promotion_policy": {
    "mode": "manual"
  }
}
